<?xml version="1.0" encoding="UTF-8"?>
<lista_indirizzi xmlns:xsi="http://www.w3.org/2001/XMLSchema-instance" xsi:noNamespaceSchemaLocation="indirizzi.xsd"><indirizzo><id>1</id><citta>Milano</citta><cap>20019</cap><provincia>Milano</provincia><regione>Lombardia</regione><nazione>Italia</nazione><via>Garibaldi</via><civico>2</civico></indirizzo><indirizzo><id>2</id><citta>Roma</citta><cap>64</cap><provincia>Roma</provincia><regione>Lazio</regione><nazione>Italia</nazione><via>del Corso</via><civico>5</civico></indirizzo><indirizzo><id>3</id><citta>Roma</citta><cap>00020</cap><provincia>Roma</provincia><regione>Lazio</regione><nazione>Italia</nazione><via>Corso</via><civico>3</civico></indirizzo></lista_indirizzi>
